{
  "schema_version": "lesson_plan_v1",
  "role": "planner",
  "plan_id": "lp_a200_d2_live",
  "node_id": "A200",
  "depth_target": "D2",
  "objective": "Understand how ownership transfer works at function boundaries",
  "misconception_focus": ["own.move.after_move_use"],
  "lesson_outline": [
    {"step": 1, "title": "Ownership transfer on function call"},
    {"step": 2, "title": "Stack vs heap allocation and drop"}
  ],
  "assessment_plan": {"assessment_type": "coding_exercise"},
  "next_action": "generate_exercise"
}
